{
  "$schema": "./brand-categories.schema.json",
  "schemaVersion": 2,
  "metadata": {
    "catalogId": "bg-beta-brand-registry",
    "locale": "bg-BG",
    "lastReviewed": "2026-07-20",
    "reviewCycle": "quarterly",
    "defaultCurrency": "EUR",
    "selectionPolicy": "Curated Bulgarian launch catalogue. Category lists are alphabetical relevance sets, not numerical popularity rankings. Audience belongs to the individual fragrance, not permanently to the brand.",
    "collectionSemantics": "Editorial discovery collections only. A collection membership never auto-assigns an audience or segment to a listing.",
    "supportedAliasTypes": [
      "searchAlias",
      "formerName",
      "misspelling",
      "transliteration",
      "productLine"
    ],
    "normalization": {
      "unicodeForm": "NFKC",
      "caseFold": true,
      "collapseWhitespace": true,
      "stripDiacriticsForSearch": true
    },
    "provenance": {
      "method": "manual_editorial_curation",
      "sourceCatalogVersion": 1,
      "externalImports": false,
      "scraping": false
    }
  },
  "otherBrandPolicy": {
    "enabled": true,
    "label": "Други",
    "minLength": 2,
    "maxLength": 80,
    "publication": "immediate",
    "moderationState": "pending_canonicalization",
    "captureFields": [
      "originalInput",
      "normalizedKey",
      "suggestedBrandId",
      "provenance",
      "auditTrail"
    ],
    "auditTrailRequired": true
  },
  "brands": [
    {
      "id": "brand-abercrombie-fitch",
      "canonicalName": "Abercrombie & Fitch",
      "aliases": []
    },
    {
      "id": "brand-acqua-di-parma",
      "canonicalName": "Acqua di Parma",
      "aliases": []
    },
    {
      "id": "brand-adidas",
      "canonicalName": "Adidas",
      "aliases": []
    },
    {
      "id": "brand-afnan-perfumes",
      "canonicalName": "Afnan Perfumes",
      "aliases": [
        {
          "type": "searchAlias",
          "value": "Afnan"
        }
      ],
      "originCountryCode": "AE"
    },
    {
      "id": "brand-ahmed-al-maghribi",
      "canonicalName": "Ahmed Al Maghribi",
      "aliases": [
        {
          "type": "searchAlias",
          "value": "Ahmed Al Maghribi Perfumes"
        },
        {
          "type": "transliteration",
          "value": "Ahmad Al Maghraby"
        },
        {
          "type": "transliteration",
          "value": "Ahmed Al Magribi"
        }
      ],
      "originCountryCode": "AE"
    },
    {
      "id": "brand-ajmal",
      "canonicalName": "Ajmal",
      "aliases": [],
      "originCountryCode": "AE"
    },
    {
      "id": "brand-akro",
      "canonicalName": "Akro",
      "aliases": []
    },
    {
      "id": "brand-al-haramain-perfumes",
      "canonicalName": "Al Haramain Perfumes",
      "aliases": [
        {
          "type": "searchAlias",
          "value": "Al Haramain"
        }
      ],
      "originCountryCode": "AE"
    },
    {
      "id": "brand-amouage",
      "canonicalName": "Amouage",
      "aliases": []
    },
    {
      "id": "brand-antonio-banderas",
      "canonicalName": "Antonio Banderas",
      "aliases": []
    },
    {
      "id": "brand-aquolina",
      "canonicalName": "Aquolina",
      "aliases": []
    },
    {
      "id": "brand-aramis",
      "canonicalName": "Aramis",
      "aliases": []
    },
    {
      "id": "brand-ard-al-zaafaran",
      "canonicalName": "Ard Al Zaafaran",
      "aliases": [
        {
          "type": "transliteration",
          "value": "Ard Al Zafaran"
        },
        {
          "type": "transliteration",
          "value": "Ard Al Zaafran"
        },
        {
          "type": "transliteration",
          "value": "Ard Al Zaafaraan"
        }
      ],
      "originCountryCode": "AE"
    },
    {
      "id": "brand-ariana-grande",
      "canonicalName": "Ariana Grande",
      "aliases": []
    },
    {
      "id": "brand-armaf",
      "canonicalName": "Armaf",
      "aliases": [],
      "originCountryCode": "AE"
    },
    {
      "id": "brand-atelier-cologne",
      "canonicalName": "Atelier Cologne",
      "aliases": []
    },
    {
      "id": "brand-atelier-des-ors",
      "canonicalName": "Atelier des Ors",
      "aliases": []
    },
    {
      "id": "brand-atelier-materi",
      "canonicalName": "Atelier Materi",
      "aliases": []
    },
    {
      "id": "brand-atkinsons",
      "canonicalName": "Atkinsons",
      "aliases": []
    },
    {
      "id": "brand-avon",
      "canonicalName": "Avon",
      "aliases": []
    },
    {
      "id": "brand-azzaro",
      "canonicalName": "Azzaro",
      "aliases": []
    },
    {
      "id": "brand-balmain",
      "canonicalName": "Balmain",
      "aliases": []
    },
    {
      "id": "brand-bdk-parfums",
      "canonicalName": "BDK Parfums",
      "aliases": [
        {
          "type": "searchAlias",
          "value": "bdk Parfums"
        },
        {
          "type": "searchAlias",
          "value": "BDK"
        }
      ]
    },
    {
      "id": "brand-bentley",
      "canonicalName": "Bentley",
      "aliases": []
    },
    {
      "id": "brand-billie-eilish",
      "canonicalName": "Billie Eilish",
      "aliases": []
    },
    {
      "id": "brand-boadicea-the-victorious",
      "canonicalName": "Boadicea the Victorious",
      "aliases": []
    },
    {
      "id": "brand-bond-no-9",
      "canonicalName": "Bond No. 9",
      "aliases": []
    },
    {
      "id": "brand-borntostandout",
      "canonicalName": "BORNTOSTANDOUT",
      "aliases": []
    },
    {
      "id": "brand-boucheron",
      "canonicalName": "Boucheron",
      "aliases": []
    },
    {
      "id": "brand-brioni",
      "canonicalName": "Brioni",
      "aliases": []
    },
    {
      "id": "brand-britney-spears",
      "canonicalName": "Britney Spears",
      "aliases": []
    },
    {
      "id": "brand-burberry",
      "canonicalName": "Burberry",
      "aliases": []
    },
    {
      "id": "brand-bvlgari",
      "canonicalName": "Bvlgari",
      "aliases": []
    },
    {
      "id": "brand-byredo",
      "canonicalName": "Byredo",
      "aliases": []
    },
    {
      "id": "brand-cacharel",
      "canonicalName": "Cacharel",
      "aliases": []
    },
    {
      "id": "brand-calvin-klein",
      "canonicalName": "Calvin Klein",
      "aliases": []
    },
    {
      "id": "brand-carner-barcelona",
      "canonicalName": "Carner Barcelona",
      "aliases": []
    },
    {
      "id": "brand-carolina-herrera",
      "canonicalName": "Carolina Herrera",
      "aliases": []
    },
    {
      "id": "brand-cartier",
      "canonicalName": "Cartier",
      "aliases": []
    },
    {
      "id": "brand-cerruti",
      "canonicalName": "Cerruti",
      "aliases": []
    },
    {
      "id": "brand-chabaud-maison-de-parfum",
      "canonicalName": "Chabaud Maison de Parfum",
      "aliases": []
    },
    {
      "id": "brand-chanel",
      "canonicalName": "Chanel",
      "aliases": []
    },
    {
      "id": "brand-chloe",
      "canonicalName": "Chloé",
      "aliases": []
    },
    {
      "id": "brand-chopard",
      "canonicalName": "Chopard",
      "aliases": []
    },
    {
      "id": "brand-christina-aguilera",
      "canonicalName": "Christina Aguilera",
      "aliases": []
    },
    {
      "id": "brand-clinique",
      "canonicalName": "Clinique",
      "aliases": []
    },
    {
      "id": "brand-clive-christian",
      "canonicalName": "Clive Christian",
      "aliases": []
    },
    {
      "id": "brand-coach",
      "canonicalName": "Coach",
      "aliases": []
    },
    {
      "id": "brand-comme-des-garcons",
      "canonicalName": "Comme des Garçons",
      "aliases": []
    },
    {
      "id": "brand-creed",
      "canonicalName": "Creed",
      "aliases": []
    },
    {
      "id": "brand-d-s-durga",
      "canonicalName": "D.S. & Durga",
      "aliases": []
    },
    {
      "id": "brand-davidoff",
      "canonicalName": "Davidoff",
      "aliases": []
    },
    {
      "id": "brand-diesel",
      "canonicalName": "Diesel",
      "aliases": []
    },
    {
      "id": "brand-dior",
      "canonicalName": "Dior",
      "aliases": []
    },
    {
      "id": "brand-diptyque",
      "canonicalName": "Diptyque",
      "aliases": []
    },
    {
      "id": "brand-dkny",
      "canonicalName": "DKNY",
      "aliases": []
    },
    {
      "id": "brand-dolce-gabbana",
      "canonicalName": "Dolce&Gabbana",
      "aliases": [
        {
          "type": "searchAlias",
          "value": "Dolce & Gabbana"
        },
        {
          "type": "searchAlias",
          "value": "D&G"
        }
      ]
    },
    {
      "id": "brand-dunhill",
      "canonicalName": "Dunhill",
      "aliases": []
    },
    {
      "id": "brand-editions-de-parfums-frederic-malle",
      "canonicalName": "Editions de Parfums Frédéric Malle",
      "aliases": [
        {
          "type": "searchAlias",
          "value": "Frédéric Malle"
        },
        {
          "type": "searchAlias",
          "value": "Frederic Malle"
        }
      ]
    },
    {
      "id": "brand-electimuss-london",
      "canonicalName": "Electimuss London",
      "aliases": []
    },
    {
      "id": "brand-elie-saab",
      "canonicalName": "Elie Saab",
      "aliases": []
    },
    {
      "id": "brand-elizabeth-arden",
      "canonicalName": "Elizabeth Arden",
      "aliases": []
    },
    {
      "id": "brand-ella-k-parfums-paris",
      "canonicalName": "Ella K Parfums Paris",
      "aliases": []
    },
    {
      "id": "brand-escada",
      "canonicalName": "Escada",
      "aliases": []
    },
    {
      "id": "brand-escentric-molecules",
      "canonicalName": "Escentric Molecules",
      "aliases": []
    },
    {
      "id": "brand-essential-parfums",
      "canonicalName": "Essential Parfums",
      "aliases": []
    },
    {
      "id": "brand-estee-lauder",
      "canonicalName": "Estée Lauder",
      "aliases": []
    },
    {